{
  "date": "2026-02-17",
  "notes": "三角比の弱点が見えた。明日は復習優先。",
  "study": [
    {
      "subject": "数学",
      "focus": "三角比",
      "detail": "チャート式の例題を解き直し。典型20問を復習。",
      "tags": ["復習", "演習"]
    },
    {
      "subject": "英語",
      "focus": "長文",
      "detail": "長文2題。設問根拠を本文に線引きして確認。",
      "tags": ["演習"]
    }
  ],
  "toshin": [
    {
      "subject": "英語",
      "course": "共通テスト英語 リーディング対策",
      "koma": 1,
      "memo": "復習で要約を実施"
    }
  ]
}
